{"bundle_id":"BUNDLE-CASE-B-1.0","case_id":"CASE-B-TRANSACTION-AUTHORIZATION-AGENT","catalog_ref":{"catalog_id":"K-CASE-B","content_hash":"c4ad4b3701ab4847ab2d5f909574ca5c87892972f1902f0650c8fef7fd8b18c1","version":"1.0"},"coverage_matrix":{"c_star_coverage":[{"c_star":1,"covered":true,"paths":[{"action_path":{"action":"release_payment","destination":"payment_rail","resource":"payment_instruction","subject":"transaction_agent"},"covered":true,"covering_predicates":["GCIR-B0001"]}],"risk_id":"B-01"},{"c_star":1,"covered":true,"paths":[{"action_path":{"action":"release_payment","destination":"payment_rail","resource":"payment_instruction","subject":"transaction_agent"},"covered":true,"covering_predicates":["GCIR-B0004"]}],"risk_id":"B-04"},{"c_star":1,"covered":true,"paths":[{"action_path":{"action":"release_payment","destination":"payment_rail","resource":"payment_instruction","subject":"transaction_agent"},"covered":true,"covering_predicates":["GCIR-B0005"]}],"risk_id":"B-05"},{"c_star":1,"covered":true,"paths":[{"action_path":{"action":"release_payment","destination":"payment_rail","resource":"payment_instruction","subject":"transaction_agent"},"covered":true,"covering_predicates":["GCIR-B0006"]}],"risk_id":"B-06"}],"obligations":[{"disposed":true,"disposition_statuses":["runtime"],"obligation_id":"INT-EVID-CHAIN-B","predicate_ids":["GCIR-B0006"],"requirement_class":"internal","risk_ids":["B-06"]},{"disposed":true,"disposition_statuses":["runtime"],"obligation_id":"INT-PAY-LIMIT","predicate_ids":["GCIR-B0002","GCIR-B0003"],"requirement_class":"internal","risk_ids":["B-02","B-03"]},{"disposed":true,"disposition_statuses":["runtime"],"obligation_id":"INT-PERMIT-BIND","predicate_ids":["GCIR-B0001","GCIR-B0005"],"requirement_class":"internal","risk_ids":["B-01","B-05"]},{"disposed":true,"disposition_statuses":["runtime"],"obligation_id":"OSFI-E21-ORR-B","predicate_ids":["GCIR-B0003"],"requirement_class":"supervisory","risk_ids":["B-03"]},{"disposed":true,"disposition_statuses":["runtime"],"obligation_id":"PCMLTFA-REPORT","predicate_ids":["GCIR-B0004","GCIR-B0006"],"requirement_class":"statutory","risk_ids":["B-04","B-06"]},{"disposed":true,"disposition_statuses":["runtime"],"obligation_id":"SEMA-SANCTIONS","predicate_ids":["GCIR-B0004"],"requirement_class":"statutory","risk_ids":["B-04"]}],"risks":[{"acs_ids":["ACS-B01-01"],"c_star":1,"disposition_status":"runtime","obligation_ids":["INT-PERMIT-BIND"],"predicate_ids":["GCIR-B0001"],"reason_code":null,"risk_id":"B-01"},{"acs_ids":["ACS-B02-01"],"c_star":0,"disposition_status":"runtime","obligation_ids":["INT-PAY-LIMIT"],"predicate_ids":["GCIR-B0002"],"reason_code":null,"risk_id":"B-02"},{"acs_ids":["ACS-B03-01"],"c_star":0,"disposition_status":"runtime","obligation_ids":["INT-PAY-LIMIT","OSFI-E21-ORR-B"],"predicate_ids":["GCIR-B0003"],"reason_code":null,"risk_id":"B-03"},{"acs_ids":["ACS-B04-01"],"c_star":1,"disposition_status":"runtime","obligation_ids":["PCMLTFA-REPORT","SEMA-SANCTIONS"],"predicate_ids":["GCIR-B0004"],"reason_code":null,"risk_id":"B-04"},{"acs_ids":["ACS-B05-01"],"c_star":1,"disposition_status":"runtime","obligation_ids":["INT-PERMIT-BIND"],"predicate_ids":["GCIR-B0005"],"reason_code":null,"risk_id":"B-05"},{"acs_ids":["ACS-B06-01"],"c_star":1,"disposition_status":"runtime","obligation_ids":["INT-EVID-CHAIN-B","PCMLTFA-REPORT"],"predicate_ids":["GCIR-B0006"],"reason_code":null,"risk_id":"B-06"}]},"cstar_profile_ref":{"content_hash":"8599ec979c8aea8d87a6d3f22777b47d3990d813db36279f307cfb82d6bbe9ec","member_kinds":["irreversible_external_effect_above_approved_bound","material_information_barrier_breach","material_statutory_prohibition","unauthorized_authority_exercise"],"profile_id":"CSTAR-B","version":"1.0"},"dispositions":[{"acs_ids":["ACS-B01-01"],"record_type":"RuntimeDisposition","risk_id":"B-01"},{"acs_ids":["ACS-B02-01"],"record_type":"RuntimeDisposition","risk_id":"B-02"},{"acs_ids":["ACS-B03-01"],"record_type":"RuntimeDisposition","risk_id":"B-03"},{"acs_ids":["ACS-B04-01"],"record_type":"RuntimeDisposition","risk_id":"B-04"},{"acs_ids":["ACS-B05-01"],"record_type":"RuntimeDisposition","risk_id":"B-05"},{"acs_ids":["ACS-B06-01"],"record_type":"RuntimeDisposition","risk_id":"B-06"}],"escalation_map":{"GCIR-B0001":{"route":"payment_operations_urgent","sla_hours":1},"GCIR-B0002":{"route":"payment_operations_urgent","sla_hours":2},"GCIR-B0003":{"route":"payment_operations_urgent","sla_hours":2},"GCIR-B0004":{"route":"sanctions_desk_urgent","sla_hours":1},"GCIR-B0005":{"route":"payment_operations_urgent","sla_hours":1},"GCIR-B0006":{"route":"compliance_records_urgent","sla_hours":1},"GCIR-INV-AUTHORITY-CLOSURE":{"route":"governance_forum_urgent","sla_hours":1},"GCIR-INV-EVIDENCE-COMMIT":{"route":"compliance_records_desk","sla_hours":1},"GCIR-INV-VERSION":{"route":"technology_change_management","sla_hours":1}},"gate_map":{"GCIR-B0001":{"gate_source":"C_STAR","gate_type":"mandatory","mandatory_role":"decisive"},"GCIR-B0002":{"gate_source":"OTHER_MANDATORY","gate_type":"mandatory","mandatory_role":"decisive"},"GCIR-B0003":{"gate_source":"OTHER_MANDATORY","gate_type":"mandatory","mandatory_role":"decisive"},"GCIR-B0004":{"gate_source":"C_STAR","gate_type":"mandatory","mandatory_role":"decisive"},"GCIR-B0005":{"gate_source":"C_STAR","gate_type":"mandatory","mandatory_role":"decisive"},"GCIR-B0006":{"gate_source":"C_STAR","gate_type":"mandatory","mandatory_role":"decisive"},"GCIR-INV-AUTHORITY-CLOSURE":{"gate_source":"OTHER_MANDATORY","gate_type":"mandatory","mandatory_role":"decisive"},"GCIR-INV-EVIDENCE-COMMIT":{"gate_source":"OTHER_MANDATORY","gate_type":"mandatory","mandatory_role":"decisive"},"GCIR-INV-VERSION":{"gate_source":"OTHER_MANDATORY","gate_type":"mandatory","mandatory_role":"decisive"}},"invariant_register_ref":{"invariant_ids":["INV-AUTHORITY-CLOSURE","INV-EVIDENCE-COMMIT","INV-VERSION"]},"judgment_record_ref":{"judgment_id":"J-CASE-B","version":"1.0"},"payload_type":"GcirPredicateBundle","policy_metadata":{"aggregation_groups":{},"precedence":{},"precedence_relation":["mandatory_failure","mandatory_pass","weighted_or_advisory"],"runtime_acceptance_condition":"A conformant consuming runtime loads only bundles verifying as signed Phi outputs (signature, payload hash, lifecycle-registry state), accepts no policy content through any other channel, and emits decision receipts carrying the requirement reference (gcir_id, acs_id and origin) of every evaluated predicate."},"predicates":[{"acs_id":"ACS-B01-01","action":"release_payment","action_parameters":{"currency":"CAD","rail":"domestic_rtr","transaction_hash":"TXN-BOUND"},"c_star":1,"catalog_ref":{"event_type":"permit_binding","template_id":"T-PERMIT-BIND"},"context_conditions":[{"attribute":"permit_valid_and_bound","condition_index":0,"evidence_producer":"authority_permit_service_v2","evidence_schema_ref":"ES-PERMIT-BIND","on_unknown":"fail","operator":"==","required":true,"temporal_window":null,"threshold_contract_ref":null,"unit":null,"value":true}],"decision_semantics":"PERMIT requires a valid permit signature whose bound hash equals the transaction hash under evaluation; indeterminate or absent evidence fails.","destination":"payment_rail","escalation":{"route":"payment_operations_urgent","sla_hours":1},"evaluation_basis":"structural_check","evidence_producer":"authority_permit_service_v2","evidence_requirement":["bound_hash","permit_id","permit_signature","transaction_hash"],"evidence_schema_ref":"ES-PERMIT-BIND","evidence_semantics":"A signed permit artifact whose payload binds the permit identifier to this transaction hash.","gate_source":"C_STAR","gate_type":"mandatory","gcir_id":"GCIR-B0001","mandatory_role":"decisive","on_fail":"SAFE_STATE","origin":{"authorized_by":"forum.chair_m_dubois","origin_id":"B-01","origin_type":"risk_derived"},"parameter_schema_ref":"PS-RELEASE-PAYMENT","policy_id":"POL-B-PERMIT","record_type":"CompiledPredicate","requirement_ref":{"obligation_ids":["INT-PERMIT-BIND"],"risk_id":"B-01"},"resource":"payment_instruction","schema_version":"1.0","subject":"transaction_agent","validity":{"effective_from":"2026-02-01T00:00:00Z"},"version_binding_ref":"VB-CASE-B-1.0","warrant_boundary":"Establishes that a valid, bound permit exists. It does not establish that the authorization decision behind the permit was substantively correct."},{"acs_id":"ACS-B02-01","action":"release_payment","action_parameters":{"currency":"CAD","rail":"domestic_rtr","transaction_hash":"TXN-BOUND"},"c_star":0,"catalog_ref":{"event_type":"amount_limit","template_id":"T-AMOUNT-LIMIT"},"context_conditions":[{"attribute":"amount_minor_units","condition_index":0,"evidence_producer":"payment_instruction_service_v1","evidence_schema_ref":"ES-AMOUNT","on_unknown":"fail","operator":"<=","required":true,"temporal_window":null,"threshold_contract_ref":"TC-PAYMENT-LIMIT","unit":"minor currency units (CAD cents)","value":25000000}],"decision_semantics":"PERMIT requires amount_minor_units <= the approved bound under threshold contract TC-PAYMENT-LIMIT for the stated currency; indeterminate or absent evidence fails.","destination":"payment_rail","escalation":{"route":"payment_operations_urgent","sla_hours":2},"evaluation_basis":"threshold_on_measured_value","evidence_producer":"payment_instruction_service_v1","evidence_requirement":["amount_minor_units","artifact_signature","currency","transaction_hash"],"evidence_schema_ref":"ES-AMOUNT","evidence_semantics":"A signed instruction artifact carrying the amount in minor units and the currency code, as recorded by the originating system.","gate_source":"OTHER_MANDATORY","gate_type":"mandatory","gcir_id":"GCIR-B0002","mandatory_role":"decisive","on_fail":"SAFE_STATE","origin":{"authorized_by":"forum.chair_m_dubois","origin_id":"B-02","origin_type":"risk_derived"},"parameter_schema_ref":"PS-RELEASE-PAYMENT","policy_id":"POL-B-LIMIT","record_type":"CompiledPredicate","requirement_ref":{"obligation_ids":["INT-PAY-LIMIT"],"risk_id":"B-02"},"resource":"payme